<?xml version="1.0" encoding="UTF-8"?>
<xs:schema 
    xmlns:xs="http://www.w3.org/2001/XMLSchema" 
    elementFormDefault="qualified">

  <!-- Root element: (Hotels) -->
  <xs:element name="Hotels">
    <xs:complexType>
      <xs:sequence>
        <!-- Hotel allowed multiple times(unbounded) -->
        <xs:element name="Hotel" maxOccurs="unbounded">
          <xs:complexType>
            <xs:sequence>
              <!-- Name element(string) -->
              <xs:element name="Name" type="xs:string"/>
              
              <!-- Phone element (string), also multiple times -->
              <xs:element name="Phone" type="xs:string" maxOccurs="unbounded"/>
              
              <!-- Address element -->
              <xs:element name="Address">
                <xs:complexType>
                  <xs:sequence>
                    <xs:element name="Number" type="xs:string"/>
                    <xs:element name="Street" type="xs:string"/>
                    <xs:element name="City" type="xs:string"/>
                    <xs:element name="State" type="xs:string"/>
                    <xs:element name="Zip" type="xs:string"/>
                  </xs:sequence>
                  <!-- Required attribute(NearestAirport) -->
                  <xs:attribute name="NearstAirport" type="xs:string" use="required"/>
                </xs:complexType>
              </xs:element>
            </xs:sequence>
            <!-- Optional attribute (Rating) -->
            <xs:attribute name="Rating" type="xs:float" use="optional"/>
          </xs:complexType>
        </xs:element>
      </xs:sequence>
    </xs:complexType>
  </xs:element>

</xs:schema>